{
  "schemaVersion": 1,
  "tool": {
    "name": "stealth",
    "version": "test"
  },
  "score": {
    "overall": 50,
    "grade": "D",
    "overallCapped": true,
    "scoringVersion": 1,
    "security": {
      "status": "complete",
      "score": 50,
      "grade": "D",
      "capped": true,
      "analyzers": [
        "vuln",
        "eol",
        "secrets"
      ],
      "deductions": [
        {
          "analyzer": "vuln",
          "findings": 104,
          "points": 40.0,
          "capped": true
        },
        {
          "analyzer": "eol",
          "findings": 1,
          "points": 8.0,
          "capped": false
        }
      ]
    },
    "tech": {
      "status": "complete",
      "score": 91,
      "grade": "A",
      "capped": false,
      "analyzers": [
        "deps",
        "maintenance",
        "duplication",
        "hygiene"
      ],
      "deductions": [
        {
          "analyzer": "deps",
          "findings": 4,
          "points": 6.2,
          "capped": false
        },
        {
          "analyzer": "hygiene",
          "findings": 2,
          "points": 1.71,
          "capped": false
        },
        {
          "analyzer": "maintenance",
          "findings": 1,
          "points": 1.0,
          "capped": false
        }
      ]
    }
  },
  "fixes": [
    {
      "location": {
        "path": "pom.xml",
        "line": 10,
        "module": ""
      },
      "points": 17.95,
      "findings": [
        "v1:3a19e3fa7f567431b1bf20e09bb929c2bf5a3f46b075984cfd1d710654fb6a16",
        "v1:44a64c04853da3642c82b2d3f8cf6ef4f05ec7883966f99ecd5f68a64a199a18",
        "v1:5d2794744d46b1d08ab2c3881682d6fb47a0cdbec814bfde04add039860041ec",
        "v1:6fcf4773f3a47e113568dbb5692db6a8e178485a2803d5c480531be12b486b93",
        "v1:a7d393e7f7eac1f1c7104630f3ec323b36ddb7ead2b2dc36d397d301f55dc825",
        "v1:b7af076d6edc6fb9fb0cc517d24232d0e2e36871ceec2acab3907cf35c67fd0e",
        "v1:c12decf9e9a1edb474e78f6c74cb02d6bc85b9f48066f15b3c97b5426a25ccce",
        "v1:c47bca2c2002acbab82038ec820406c8a7a50a49303d31572a54060b8553acba",
        "v1:cca02272275fde7a632a5ed61507a3344b5575b49e254e37f7ea81f89fad9b9f",
        "v1:d0e7127a0e4f370c41d5993340728b7f1333beec2db0711f785603ca83dc8103",
        "v1:ff574d9dbdf7ffca0561e40b1e7dc710985b8a56bc079f97777571c55849be13",
        "v1:495e785bee2237471c9a7abcba1dcdb3424a0547c2f76f13fe9b048a58e631b6",
        "v1:0621e1ce9b39ac208c3c2a152373671fd9d02b4ce2da9259981d5723f063bdd9",
        "v1:0feea032a48a5df6f0e47fa03759368b13ecd97a8b8be468d56fc4de3a321d78",
        "v1:27684d77fd571e56e5cf2a216c05c7c83b15fbe75856b34fa0a234ba989f321a",
        "v1:2853454c8bc9f560430b1b6ff4da6a6134cda9f3a41169ce9cbfea52d07b6235",
        "v1:29e7be9877a3de735f7271bf4883ea52188e59b58011a640403b01067ceb2a7a",
        "v1:2fa0f75c353ad25c08d123a755132ad845762b29969e7302546df74b4e7d3c6f",
        "v1:3b39cf5326debb8e0998ae09ae79b6d7e2d6cd8aaff2330889026ca8b14f7287",
        "v1:3f4a2353ed16e7d96061642905872167afd3a1a0e160d677982217e378ab87e8",
        "v1:4c74c67ef69c6fa418a5068b6030fb995ca14f48067600834767336e2cc9e021",
        "v1:518f7f5b4c4f1629acdf586671a095a146785e89a093e3acca5b040d2d8e6b21",
        "v1:53718878b6c2b1892d0b71518588fd903d140b8ab7b1f0bb077f8096fe9e6f48",
        "v1:55362a0b53249f3ccbc814d9e2d7f360e9c51e685c4da658e4128d8800c0497d",
        "v1:58cb359e9ca43ea96578c617bb8c99db2cf402f61a446e62a58bca73d4515ad3",
        "v1:5ccab6b5f6adf308f24b69d7d3d60b59f5ee2eccaf83d478a78e941cb8eeda5d",
        "v1:62e70f9fe1424a76a5e44b7ab688b9ee1af01252b746fbcc1c638a719f1040a6",
        "v1:630ac4f5e357a7074095645d0ab6bbf1c853c792c57ab2b0182b1beb4e264ab6",
        "v1:6796511f133acb0c850d60e14220d40434e287a324713617e395a3e3fa4f74e4",
        "v1:6b52ea61e15ef86219233bb5f88b87bdd31e720a061644a0db14ba3050a47177",
        "v1:74bfe544498bafa8eb77431a913b4068911d24c6942fbd45a84cd8ef8663e697",
        "v1:791a3ba60c3039b5f354370de5e15b2d62d9d08bb1c831e69a42332dfc6193c1",
        "v1:7ef7f0bc03151ce90dafa6b0f56104f2cbb1df02c1d2775450d34e10afb63d08",
        "v1:896696658496c0f0a4ed590bdf71c050e9d7ba7df4fe02fb2fbe774eab882654",
        "v1:8e154f63965ea1dbb28d13f1de7cc1e343b301e50938368cb6cd22f3c1da728b",
        "v1:92540af8e7b58906699356d40b8edfda65bcb8245fe6aa19fe81c00eea316adf",
        "v1:a27a7924cf796f942a1e3d7cba261096a3f0af7d025ebf21c12eca0426888f00",
        "v1:afc367c2dd377592ff446d62433a9a3cfa7ed98e277b84a488fa7faeeae93d14",
        "v1:b9ebbd6e0594df8fdca683c01f93a88f87802fbc45e1f9cf12611d1fef2b3772",
        "v1:bcf6e0825756e0b3a22e8c7338ee4e5f7ae7789fb46ef8c13a688787917a2ef2",
        "v1:cc1005cc8f3293416f989b4a3a7373b573d1e9a8c0475825fc1e49c5572a09f5",
        "v1:cfdb28dddc3b4494d8912f3392075fb79e86a226219b8b881e9d8865400212e6",
        "v1:d388854aae5baa1b4eae98ad5c39e32cd8cf1f845709179fe3363afd4aa858ac",
        "v1:dc097eb535c286cb9cbd4858b45fcd9b67d827c03ff84792dcedc53a9821d695",
        "v1:de253792a293306fae3ed4590678abf15e1b1ddfd56949963ece4f15385482f9",
        "v1:e033c8eff7d1a6dd2efd42589682326ea53130758b5bba742beaaf446e638ced",
        "v1:eef5a6dd422d1b25583a2e1ae8c27c7d0396284dcfcecf06e297533e659e558e",
        "v1:efdff9d81e222c8423ffeaf874c674e79b5a1d9d85f25865df7ba2996d8c43b2",
        "v1:f63bbc4b32ce93769a014ab0192eca79239330b1d3fb98fd941bd63490d8598c",
        "v1:fb2fd2ab7a4ebaf9c1058bfd25c36a58897c24c419c97d583ec1cc983eb9a6ca",
        "v1:ff407474deed5c86849fa7b54010964eb91fddd59ead9d14ad656f41d483904a",
        "v1:ff7f4d00fe9a75e8e7ae76607ce018ffe967b7131e779cdcd840fd68ef2a628e",
        "v1:ee62b6880a54625e8f204461328049415af622f21ffb805d256cc36d0cfa0a37",
        "v1:030420dab515dd070812c295f32d771ffb27bf837fa4a786c3bb5d95dae1f52f",
        "v1:03d22ddb9b9c557c30b4fe90a6b97268fba677ec3983cb2043c15e1442236614",
        "v1:0a930d83be8737af1596130508c53d6e3a52f0ce06487f5d07fc608ed390c55f",
        "v1:0b4a717cad26d6a6f7ee804f5e622786b40c5d3a2290760022c02d7a9ae82396",
        "v1:0be8790f54bed57e66fd25cd9cf062818f0057fe15d8ccd30d1ee3f768c0bdb6",
        "v1:16845ac6e5b3707a4a5cb8a81d24e74c11f130e3540cc13022bd4ef395fd5d22",
        "v1:1c42d01213eab90fa55b2e9ea283e97345d5e740c0ebc7d1ed5677b2fde42ef2",
        "v1:1e04f1df6d33bdbbbe928de46c693d0d4212fbe39bb7eb668081580e00b57684",
        "v1:2816e63a57260092d3071789531d8eb4228cf17fc30d9855963cd9228c96a9bb",
        "v1:2848a5dda14303d1c72ee6db1ed16b78aa9c8357ead9c4dddbac0ff10727399f",
        "v1:2d96ccc2a3461ce09d331e910d26ceb7cbbe9c6b55fa8655b0fb4a20ed037079",
        "v1:352bda1671254d528316ede8da8d16dc4caec792a612d0152540362fa02a7f53",
        "v1:3639ce9f6fbe8400859450a29f731f1102eb66fd5ae754575bdea24abfd8cb43",
        "v1:393645314c70ff44d70234fe27fd9b4b5fb7ebc40de80094e86c6c249ae27639",
        "v1:3ee62a4eb5fadcd6023edadd98d4ac217d276b6df384eb6c44c9b89bb722850f",
        "v1:5449e163fed290df77d21ef028b9c70f3160250f9248eec1d5f685087704668c",
        "v1:5c85b29040ce43c9ea4e712252e1fed73ab04aa9a1f38025d811a47add7f291a",
        "v1:5cd5035757667854239cb1ed18f29d16094134853a12eac2f76946f338a78a32",
        "v1:61251aba9e3e0f85250f5418a98406afe2f6fcf31cd1a4a3e09a53ef6551fe97",
        "v1:649ad9c256b8626ba26155a978a4e6a20afddd87674ae94bf6e7aa82f6a516a2",
        "v1:6a4eeb77233b5b9b2793456d2def5f04c510358b7ff98f5bc8256b86d8ac4c39",
        "v1:6b16545c2bd4faa4e23e06ee34582bfa68f94b70ece4faa81b7eef969dc17cad",
        "v1:734becafe06a73e8c1a09a9fb3387292a7edc54b3ec85a6e15dd4f59dce34e44",
        "v1:7fcdf0bedbb348c78a95f02839d9033bf94016334d62df222ba21ea456ff6774",
        "v1:94e5417f8e600144eb566e80177ef1265ec3ae58073ee8924149faab2989d423",
        "v1:977f0a13c79aa13302238a1cefb0d830fe3cb59683ead04e9b626f28cc3697a6",
        "v1:b2f42cf5b042130d94a6e24274024feaf29292e6a04dfec5d25cb08e9962df35",
        "v1:bd070d5b792743d0bc76accfecbc729a01cb975e45ae20bd5dbc3109843fd13c",
        "v1:bee5db4f1f432a6067a1315b94b5ea6e5676dc3213b9119df50eb72007f1ea1c",
        "v1:d3a2ad6f554f9dc4292d20035d59215634e26f322f3ce1ea32fbe043d52be71c",
        "v1:d55db4f28969c4ceea76cbc5026f2db97e620488e168a174c723ed79ee7117b1",
        "v1:e55780d15b05bb5a48e6b9bab6b67b38e781a5cbb7b7149920a09fba8767b60d",
        "v1:e66e4763db675dcae17c4fe5f8d4385bc5b111dfdc194bbdf76dc3d8d11b1b2c",
        "v1:ea19404cfe4e4be26f127a32a4b86df29da5ae4e8f55897e5ac8b1e97351e7dc",
        "v1:eb8e46c2979f8f1c2060cbfdaa74d2626a7aac5516042d44e971be8e47c82914",
        "v1:f8697c6e6f1d224e5bdb0ac3a26dc8452b77d8dfe201ce7def67930b1dcf3810",
        "v1:07e22389a91bb3c641ab167107ae80f8cd917e865b0ceaf876ad8789c79a3bc8",
        "v1:082b6dc52da84dfa9ce0ff9f76944e6b5b756b95010c397c6a2b2cf122e450c7",
        "v1:11073376ce0233e1bf7b0d25ed49d9cb548be222f7643d09c51c33e51729557e",
        "v1:17a63e44a839513450180b519b35a194b3e38b0df8da029f2e5882fc33182c15",
        "v1:3e6ea7bb996e53b4242ed1503ee058620ad9540efc4c2f4c70dff9803bf854d9",
        "v1:55f329fc05f6bb41c4d9744bad13596e8559e03b8b23dd378be9e2eed6674a89",
        "v1:5faa58f6c1124bf9fab01ca81bbce4a779f23536400679c888e29bbcf2a56601",
        "v1:7336480c34316d0d429dfef6db3ad75fc41f17902e0669490786a7945c977c41",
        "v1:75f9d59552407d26cc587ac6680a8d7d6b2a68d10381fc4f0770d61d34958432",
        "v1:8b9af0f117162c431be3811da611b384a97ea764d84dcece327acb2f3fee5e35",
        "v1:988b4892d48227c19c1f61add2af1ef3c9b26a416d25eb5756401c8e62758e8f",
        "v1:a272f92dc9f0b0e37f3cadc485f63b220a56464639018cdb33c59a6e910ae143",
        "v1:f7970c7044cd603c2b02a2806e8d2b67fc48275d6ab7af3a27e8a3606ca92ee1"
      ]
    },
    {
      "location": {
        "path": "pom.xml",
        "line": 40,
        "module": ""
      },
      "points": 0.2,
      "findings": [
        "v1:bb6418be4ba3a4ff4e8db661cfb893e16e9b49ec9ac0b41d4cbe1781493539f0",
        "v1:70e62c2fca55c201185e34f08dff42251346d583745ac72aec8eed630f5074e2"
      ]
    },
    {
      "location": {
        "path": "pom.xml",
        "line": 35,
        "module": ""
      },
      "points": 0.77,